{
   "id":"por-ard-gs",
   "index": 1,
   "title":"Creating GUIs With LVGL",
   "slug":"por-ard-lvgl",
   "authors":[
      "Pablo Marqu√≠nez",
      "Lenard George"
   ],
   "coverImage":{
      "src":"assets/por_ard_lvgl_cover.svg?sanitize=true"
   },
   "tags":[
      "USB Host",
      "LVGL",
      "GUI"
   ],
   "abstract":"In this tutorial you will learn to use LVGL (Light and Versatile Graphics Library) to create a simple graphical user interface that consists of a label that updates itself.",
   "previousArticle":"por-ard-kvs",
   "nextArticle":null
}
