{
   "id":"por-openmv-gs",
   "index": 1,
   "title":"Getting started with OpenMV and MicroPython",
   "slug":"por-openmv-gs",
   "authors":[
      "Sebastian Hunkeler",
      "Benjamin Danneg√•rd"
   ],
   "coverImage":{
      "src":"assets/por_mp_gs_cover.svg?sanitize=true"
   },
   "tags":[
      "Getting Started",
      "OpenMV",
      "Setup",
      "MicroPython",
      "PWM"
   ],
   "abstract":"This tutorial teaches you how to set up the Arduino Portenta H7, how to configure your computer and how to run a MicroPython script with OpenMV.",
   "previousArticle":null,
   "nextArticle":"por-openmv-bt"
}
