{
   "id":"por-ard-kvs",
   "index": 8,
   "title":"Creating a Flash-Optimised Key-Value Store",
   "slug":"por-ard-kvs",
   "authors":[
      "Giampaolo Mancini"
   ],
   "coverImage":{
      "src":"assets/por_ard_block_device_cover.svg?sanitize=true"
   },
   "tags":[
      "Storage",
      "Key-Value store",
      "Flash"
   ],
   "abstract":"This tutorial explains how to create a flash-optimised key-value store using the flash memory of the Portenta H7.",
   "previousArticle":"por-ard-trace32",
   "nextArticle":null
}
