{
   "id":"por-openmv-bt",
   "index": 5,
   "title":"Blob Detection with Portenta and OpenMV",
   "slug":"por-openmv-bt",
   "authors":[      
      "Sebastian Romero"
   ],
   "coverImage":{
      "src":"assets/por_openmv_bt_cover.svg?sanitize=true"
   },
   "tags":[
      "OpenMV",
      "Blob Detection",
      "Machine Vision",
      "Machine Learning"
   ],
   "abstract":"This tutorial will show you how to use the vision carrier board for Portenta to detect the presence and the position of objects in a camera image.",
   "previousArticle":"por-ard-ble",
   "nextArticle":null
}
