{
   "id":"por-ard-usb",
   "index": 4,
   "beta": true,
   "title":"Portenta H7 as a USB Host",
   "slug":"por-ard-usb",
   "authors":[
      "Jose Garcia"
   ],
   "coverImage":{
      "src":"assets/por_ard_usbh_cover.svg?sanitize=true"
   },
   "tags":[
      "USB",
      "HID",
      "RGB LED"      
   ],
   "abstract":"This tutorial teaches you how to set up the Portenta H7 to act as a USB host in a way that allows to connect peripherals such as a keyboard or mouse to interact with it.",
   "previousArticle":"por-ard-ap",
   "nextArticle":null
}
