{
   "id":"por-openmv-fd",
   "index": 6,
   "title":"Creating a Basic Face Filter",
   "slug":"por-openmv-fd",
   "authors":[      
      "Sebastian Romero",
      "Lenard George"
   ],
   "coverImage":{
      "src":"assets/por_openmv_fd_cover.svg?sanitize=true"
   },
   "tags":[
      "OpenMV",
      "Face Detection",
      "Haar Cascade",
      "Machine Vision",
      "Machine Learning"
   ],
   "abstract":"In this tutorial you will build a MicroPython application with OpenMV that uses the Portenta Vision Shield to detect faces and overlay them with a custom image, in this case, a smiley.",
   "previousArticle":"por-ard-bl",
   "nextArticle":null
}
